{
  "$schema": "https://json-schema.org/draft/2020-12/schema",
  "type": "object",
  "required": [
    "jsonrpc",
    "id",
    "method",
    "params"
  ],
  "additionalProperties": false,
  "properties": {
    "jsonrpc": {
      "const": "2.0"
    },
    "id": {
      "$ref": "#/$defs/id"
    },
    "method": {
      "const": "ai.credentials.upsert"
    },
    "params": {
      "$ref": "#/$defs/credentialUpsertParams"
    }
  },
  "$defs": {
    "id": {
      "type": "integer",
      "minimum": 1,
      "maximum": 2147483647
    },
    "credentialUpsertParams": {
      "type": "object",
      "required": [
        "channelId",
        "label"
      ],
      "additionalProperties": false,
      "properties": {
        "id": {
          "type": "string",
          "minLength": 1
        },
        "channelId": {
          "type": "string",
          "minLength": 1
        },
        "label": {
          "type": "string",
          "minLength": 1
        },
        "baseUrl": {
          "type": [
            "string",
            "null"
          ]
        },
        "secret": {
          "type": [
            "string",
            "null"
          ]
        },
        "enabled": {
          "type": "boolean"
        },
        "initialModelIds": {
          "type": [
            "array",
            "null"
          ],
          "items": {
            "type": "string",
            "minLength": 1
          },
          "uniqueItems": true
        },
        "thinkingEnabled": {
          "type": [
            "boolean",
            "null"
          ]
        }
      }
    }
  }
}
