{
  "jsonrpc": "2.0",
  "id": 7,
  "method": "ai.credentials.upsert",
  "params": {
    "channelId": "openai",
    "label": "Primary",
    "baseUrl": "https://api.openai.com/v1",
    "secret": "example-secret",
    "enabled": true,
    "initialModelIds": [
      "gpt-4.1-mini"
    ],
    "thinkingEnabled": true
  }
}
